{
 "version": 1,
 "call": {
  "id": "praxis-termin",
  "startedAt": "2026-09-25T08:03:41.000Z",
  "versions": {
   "sdk": "livekit-agents 1.8.3",
   "agent": "praxis-inbound v8",
   "prompt": "praxis-termine@12"
  },
  "title": "Praxis Dr. Berger · Termin verschieben",
  "direction": "inbound",
  "language": "de-DE",
  "duration": 51.925,
  "consent": "granted",
  "outcome": {
   "goal": "Termin verschoben",
   "achieved": true,
   "new_slot": "Do 14:00"
  },
  "synthetic": true,
  "provider": "livekit"
 },
 "clock": {
  "t0UnixMs": 1790323421000,
  "channels": [
   "caller",
   "agent"
  ],
  "sampleRate": 48000,
  "tolerance": 0.1
 },
 "audio": {
  "sources": [
   {
    "src": "/calls/praxis-termin/call.ogg",
    "type": "audio/ogg; codecs=opus"
   },
   {
    "src": "/calls/praxis-termin/call.mp3",
    "type": "audio/mpeg"
   }
  ],
  "peaks": {
   "caller": {
    "rate": 200,
    "min": "//////8A/wD//////v7+/v7//v7+/v///v7+/v/+//7+/v7+/v7+/v7//v///////v7///7+/////wD///7///7+/////////////wD//v/+////AP////7//v/+/v/+/v7+//7+///+/v7//////v/////////////+/v7///7+/v79/v7+/v7////+/v////7+///////+/////////////////////v/+//////////7//v7////////////+/////v7///7////+/gD//////v////////7+/v//AP8AAP////7///////7+/v7+//7//v7///8A/////v7///////7+//////////7+//7+/v7///7+/v7+/v7//v/////+////AAD//////v7+//7/////////AP////7+///+/v7+/v/+/v7+/v///v7+/v7+/v7+/v/+/v///v7//wD//wD//////v7+/v7//v///v7///////8A///////+/v////7//////////v/+/v//////////AP////////////////8A/v7+/v7+/v7+/v/+/v7+//7////+//////7//v7/AP////7+/v7//v7////+/v7+//7+/v/+/v////8A////////AP8A/////wAA/wD/AP///v7/////////////AP/////+//////////////7+/v//////AP8A//////7+/v7//////////wD/////////////AP///////wD///7////////+///+//////7+//7//v////7///7+/v7////+/v7+/////v////7////////+/v7///7///7+//4A///////////+/v7////////+/v7+//8AAP/////////+/v7///////8A//////////////7//wD///////////7///7//v7///////8A//////////////8A///+//////7+/v////////////7////////+/////////v7////+////////////AP/////+///+/gAA/wAAAAAAAP8A//////////////7//wD////////////+///+/f7//v7+/v/////+/v7/////////AP////////7////////+/////////////v////7/////AP////////7//v7//v7+//8AAP//////AP/+/v7+///+/////////v7+///+/v7///////////////8AAP8A/////v7+/v7+/v7+/v7//////v7+/v///wD///7+/v/+/v7+/v7////+/v///v////7+/v7///////7//////v////8A//7//////////f3+/v7+//7////+///+/v7//v7+/v7//wD//v7+///+/v///v39/v7//////v7////////+/v/+/v7///7+/////wD/AP8A//////////////8A/v/////+/v7+/v7+/v7//v7+/v////7+/////////v7+/v/+/v/////////////+//////////////////////////////7+/v7//////////////wD///////8A//////////////7+///////+/////////////////vb7/fv6+fn59vj48vf29ff59fr8/P3///7+/////v7+/PX78frt7PHp+ODV69LM4cfS6ODj6O/r8vDz9PL09/n19Pf39Pj1+PPx+Pb2+/7+/wD/AP/////+//////7+/v/z8/v9/ebd1trY3uXo7PX09vb59/v07//u7vzt7u3v+O/58OTp6fHt7Onu6+/m7uTx6/Pn9fH77+3t7vfv/O/88fru+ezu8O778vvz/Pf6/f3+/v7+/v/+9Pv6/Pv9/f39/v3+++/55/nl++X65/nm9+r37Pby/Pj89fz0/PT79vv1+fX68vvx7/Dp9ubr5uby5OT15+fz5+n16ez27/b69PDz+PP09fb19vb2+Pb39/f4+Pj4+vz9/v79/f7///7+/v////8A/wAA///+/////v7+/v399u/49vbw/PL57/jv+O/79Pv1/fn+/P3+/f7+/v7+/v//////////9/z7+uzz6Oby4uT75+jp+Ozq5+3q6+np6e3q6+vs7fXz9vz9/v7////+/v7+/v/+/v7+/v7/AAAA/v/+/vv+/OzQys/h093h4eHm4uPh4Nnh4OPx+P3+////////7/v5/v38/f39+/39/Pz8/fz9/v3+/vz79tjTy83R09je6vDu8/f1+PPr8/Dz8fPy7uzx7u/u7vX3+Pr+/v7//v777ezq6fHq7ezw9PH28vf3/fv+/P79//7//v7+//z2/PT78/v49f32/PT7+f36+v37/v3+/v/+/f///////wAAAP8A//////8A/////////////////////v///////wD/////////AP8A///////+//////////7+/v7//v/////////////////+/v7+/v7////+/v/+///////////+//7///////////8A////AP///v///v///wAAAP///v///////v/+//7//v7///7+///+/v///v4A//7///7+/v//////////AP///v7+/////v7+/////////v7///7+//7+/////v/+/v7///////7///////////////8AAAAAAAAAAP8A//7+//////8AAP//////////AAAA/////////wAA///+/v////7//wAAAP///v/+/v///////////v/////+//7///////////////7//v///////v///v/+/v8A///+///+/v/+///+/v/////+//7+/v7+/v///v7+///+/v7+/v39/v/+/wD///////////////8AAP8A/////v////7/////AAAA//8A/////////v7+/v3+/v7///7//v8AAP/////+/v////8A///+/v////////7+/////v7+///+/v/////////+/v7//v/+/v8AAAAAAAD//////////////////wAAAAAA//8A//////7/////////////AAD//////wD///////7///7//v7//////v/////+/v7///////////////////7+/v///v7//v7///7/AP/+/v/+///+/v7+/v/////////////+/v///wD///////7+///////+///+//7+/v///////v7+//////8A/fP26fPm7ePn8OHt4u3g5ePk8uTw5eTm5/Hj8+Pl8uz86f3o++nt6uzy5PXt9e3o+Oj26ffo5/Po+uzv8fT49fr5/Pz7/f7+/v39/f39/f7+/v79/v7+/v7+/////////vsA+P30+uH55Prg7d7x2d/c5/nc+OD34vni9uTv6fT3+Pv4/v7+/////wD////////9/P/+///////+//34+/b89fv0+vT69/r89/z3/fj8+fr9+f38/f39/v/+/v7///7//v7+/f7+//////7//v7//v7+/v////7+///////////////+/v///////v7+/v7/////AP/+/v///////////v////7+///////+/////////////v7+//7+//7+/v7/AP/+AAAAAAD//wAA////////AAAA/////////v///wD+//7////+/v///////////v7//v/+//7+/v/+/////v7//////////v///////v7////+/////wAA/////wAA/////v7+//7+//////////7+/////v///v8A//////8A////AP7///////7///////8A//////7///7///8A//8A//7//////v7///////7+//7+//7+//7+/v7+/v//////AP///wAA/wAA////////AP////////8A//////7//v7+/////////v/+//////////8AAAD///////8A/wD//////v/+//7////+/v7+//7//v7+/v////7+//7+/v/+/////////v////////7///7//v/+/v7+/v7+/v7+/////v7+/v////////7//v/+///////////+//7//////////////v7/AP/////+/v7+/v7/////AP///v7///7+/v7+/v7+/v7+//////////////////////////7//v7//////wD//wAAAAAA///+/wD///7+/v7//v7+/v////7////+AP/+/v////7//v/////+/v3+/f7//v/////+/v///////v/+//7+/v7+/v7////+//7+/v7+/v7///4A/v7+///////////////+/v//////////AP/////+/v7//////////v7///7///7+/v/+/v7+//////////7+/v///wD/AAD/AP////7+/v7//v////7+/v7+/v7+/v7+/v///////v/+/////wD///////////////8AAP///v7////////+/v7+/v///////v7////////////////////////////+//////8AAP////////8A//////8A//8AAAAA//////8AAP////8A//////8A/wD////+//7//vnr6+bn6Obk7OXj5OH54OLv5/jq++rz7+7x8PXv9PLy+vL89fz2/Pn9+vr++/78//7///7+/////////wD///8AAP///////wD//////////////wD//v///v///v/+/v7///7///7////+/v7//////////wD/AAD////////+//8A/////v7///7//v7+//7+/v7//v7////+//////7+/////v7+//7+/v7+//7+/v//AP///wD/AP8A//7+/////////////v7+/v/+//////8AAAD//////////v///////////wD//wD/AAAA//8A////AP8A////AP7///////7+//7+/v7+/f7+/v7+/v7+///+//7+/////////////////////////v7+/v/+/v7//v/////+/////v8AAP/////+///+/v////////////7//////wAA/////v///v7+//////////7+/v7//////////v////////8A/////v7+//7+//////////8A///+/////////v7//v7+//7///////7+///////+///////+/v7+/v7+///////////////+/////////v/+/v/+//7//v7+/v//AP///v/+//////////7///8A//8A/v/+///////+/v7//v///v///////////v///////wAAAP8A/////////v/+/v7///7+/v7+/v7////////////+/v7+///+/v7+/v////////7///////7+/v///v7+/v7+/v7///7+/v7//v7+//////7+/v/////+/v/+/v7/////AP8AAP/////////+/v/+//7///////////7//////v/+/v/+/v//////////////AP//////AP//////AAD////////////////+/v/+/v7+////////AP/+///+/v7+/v7+/v3+/v7+//7//////wD//v///////////////////v7//////v7+///////+/v7////////////+//////////7//wD//////v7//v/+/////////////v///v7+/v////7////+/v7+/////wD////////+/v7+////////AP////////7//v/+/v7+/v7+/v7+/v7/AP7+/v////30+e/97fzi3fbf5PXt7eno6enl5unt8Pb29/n7+Pn4+ff0+Pj7/P3+//7//////////v8A///+///+/v7+/v////7+//////7+//////7+/v7///7+//3+///+/v7//////v7//////////v7+//7+/v7+//7+/v/+/v///wAA/////vz48Pj66uz28PL3+fr3+/j09PP28vX19fj5+vr8/f/+///+/v79/v7+/fz69Pvz9+726/T65fbj+N324fPh9fT+/v3//v7+/v///////v7++uv56Pn0+u/58Prx+vD68fLx8Pju/e/u7/H/8PHx8u7t6+fo5eXi4+Ph39/h5OTq7/j5/P3+/v7+///7/f79/Pv8/fr7+vz8+/v6+fv7/P39/v7//f3+9d7c2NTf5/P1+Pr5/fv9/f39/f3//O77/vv35eXZ3NDQ59nn5fnu+/j5+v79//39/fz+/P79/f76+Pj87vvm/OT74/rk8vjp+/D68vn89vv3/v7///7//////////v31/v/+/v7////+//7///7+/v/+/v7////+/////v7+/v7+//////7///7//////v7+///+/v7+//7+//7+/v///////v7+/gD//v7+//////////8A///////+///////+//vw9ufa48vBysnrz83p1PHQzeDF0OTi7fbx8PHz8vT09ff49vr8+vn59vj1+fLx7e3q7PP6+v39/vvr3djf4/Dz+v/9/f3+//7+6fz4+fr5/Pr8/P39/v789/nr5/fi+d7t4uzz7vPs+er47Pjt7uvr9Ov44+Lt3+ji4+Lj6On47O3u8O3u7evr7Ovr6+jo7efs6+rr7evy6/D3+fn4+fz6+/f69+/m8dzX1c/q0NXd1fDW3dXV5dPz2vXf8OLi9ur08vn6+v79/Pz9+vz5+vf2+vf88/j2+fT29fb89P33/fz+/vz+7fb7/fru+uz47/nz+vf2+/j8+v38/P79/v3+/v7+/f3+/v////7+///+//////7+//7///7//wAA/wD//v/+/v7+/v7+/v/////////+/v7+/v////7////////+//7//////////////////////////v7//v//AP//AP////////////////7+/////////v7////+/v///v7+/v7+/////////////////////////wD//////v/+/v7//////v79//7+/f7+/////v79/v/+/v79/v/+/v/+/v7+/v///v7+/v/+/v///v///v////////7+/f7+/v/+/////v////7+/v/+//7//v7+/////v////7+//7//wAAAP/+//7//v7+//8A//7////////+/v/+/v////////7///////8A/////v7///7+/v7///////7//////////v7///////////7+/v7+/v7///////7///////7+/v///v////7+/v7+/v3//v7///////////7+/v7+/v/////////////////+/wD//wD//////////v/////////+/v/+/v/+//////8A////////AP////7//v7////+/v/+AAAA/wAA//8A//8AAAD//v////////////7/AP8A////AP/////+/v///wAA///+//8A//8A////////AP////8AAAAAAP/////////+/v7//wAAAAAA//////////////////////////7+/v7///7//v7+//8A////////////////AP//AP7//v///////v7+////////////AAAAAAAA//8AAP///v///////////////wAA//////////////8A////AP/////+///////+//7///////////////7//v7//////////v8A////AP/+/v///////v7////+///+//7+/v7//////wAA/////v7//v///v/+//7+/v7+/wD///////7+/v7+////////AP////////////7+//8A/////////////wAA//7+/////////v/+/v7+/v/////+/v7+/f7///7+/v7+//7////+//7+/v///v8A///+AP7//v7+/v/+////////////AAAA/////////////v7//v///////v7+//7+/v7+//7+/v7//v7+/////v///////////wD////+/v////7/////////////////////AP////8A///+//////7+/v/////////////+//7///7+/v/+//7///////////////////////7//v//AP8AAAAA//////////7+//7////+/v7+/v7+/v7////+++jx3vfg8efx5+Xh5fXs9N3b3tjl2Nvw3uHq3tnU4tTP5NLW59fc7N3h6+fz9vT1/fn8+/37/f38/fz+/v7+///+/v7///7+//77/Pv31+vLx+/LysnR69PR3dvt3+Dl4eLk4u7j5O7l4eXd99/i+ev6+/3+/f7//////////uv8/f3+/wD////////+/v///////v7//v////////7+/v/+/v7+/Pz58/jt8vnv+PL59v31/vX+9/32/fb99vz5/vv+/v/+/f7+/v7+/v7+/v7+/f38+/v79vn6+vn6/vz9/v7//ff16+jk7uLf4eDq3tzZ2OnZ3eLo9fX9/v///v7//v7///7+/////////////////v7//v7///7+9ubd5OD14t/j7ufu6urv6ert+e/x+fP8/f36/v7+/v/+/v7+/v7+/vz6+fn2+ff39/f59/T98/Dx8Pvt7ezk6eLp29jm1+jW2NvX6Nrv3vfh9+f96vry/fX9+v36/f7+/v3+/f////7+/v7+/v////7+////AP8A//7+/v7/////AP//AAD7/Pz75fHa9OD78QD+AP/+/v//AAD//v7+///59vT4+Pr9/f39/P349PH99f74/f3+/v3+/f79/v3+/v7+/v////////7//v////7//v7+///////+/v/+///+//7/////AP8AAAD//////v///////////v///////////////v7+///+/v7+/////v7//////wD///7+/v/+/////v7+/////////wD/AP/+/v/+//////7//////////v/+///+/v/+/v7+/v7+/////v/////+/v7/////////AP///////////////v////////7//v7+/v7+/////////f3//v7////+//7+/v7+/v7